{
  "spec_version": 2,
  "id": "lab09_pca_analysis",
  "title": "Principal Component Analysis",
  "title_zh": "主成分分析",
  "objective": "掌握用 PCA 对多波段影像做降维的方法：把 7 波段影像压缩为 3 个主成分，并解读各主成分所承载的方差与信息。",
  "prerequisites": [
    {
      "path": "data/samples/landsat_sample.tif",
      "note": "7 波段类 Landsat 样本影像。"
    }
  ],
  "steps": [
    {
      "title": "Load Multi-band Image",
      "title_zh": "加载多波段影像",
      "description_zh": "加载 data/samples/landsat_sample.tif。相邻波段间高度相关，PCA 用线性变换把信息集中到少数主成分。",
      "action": "addRasterLayer",
      "completion_hint": "7 波段影像已加载。"
    },
    {
      "title": "Run PCA",
      "title_zh": "执行 PCA",
      "description_zh": "执行 rs:pca 算子，把影像降为 3 个主成分（numComponents=3），输出 pca_result 影像。",
      "operator_id": "rs:pca",
      "params": {
        "input": "data/samples/landsat_sample.tif",
        "output": "outputs/lab09_pca.tif",
        "numComponents": 3
      },
      "teaching_note": "PC1 承载最大方差（约占 80%，主要反映总体亮度），PC2 次之（常反映植被—土壤对比），PC3 及以后主要是噪声或细微特征。",
      "completion_hint": "输出影像为 3 波段而非 7 波段。"
    },
    {
      "title": "Analyze PCA Results",
      "title_zh": "分析 PCA 结果",
      "description_zh": "逐波段查看 PCA 输出：比较 PC1、PC2、PC3 的亮度分布，把主成分与地物分布对应起来，理解方差—信息集中的含义。",
      "teaching_note": "PCA 常用于数据压缩、去相关与噪声分离；MNF 是其考虑噪声模型的推广。",
      "completion_hint": "能说出各主成分大致承载的信息。"
    }
  ],
  "thinking_questions": [
    "为什么前几个主成分能保留原始影像的大部分信息？",
    "PC2 上的正负值常对应什么地物对比？结合特征向量解释。",
    "PCA 变换后的波段还可以逆变换回原始波段吗？会损失什么？"
  ]
}
