{
  "spec_version": 2,
  "id": "lab07_image_fusion",
  "title": "Image Fusion",
  "title_zh": "影像融合",
  "objective": "理解全色/多光谱融合的原理与效果：分别用 Brovey 与 IHS 方法把高空间分辨率全色影像与多光谱影像融合，得到兼具高空间细节与光谱信息的成果。",
  "prerequisites": [
    {
      "path": "data/samples/landsat_sample.tif",
      "note": "本练习以同一样本影像同时充当全色与多光谱输入（教学演示）。"
    }
  ],
  "steps": [
    {
      "title": "Understanding Fusion",
      "title_zh": "理解融合概念",
      "description_zh": "阅读并理解：全色波段空间分辨率高但只有单波段；多光谱数据光谱信息丰富但分辨率较低。融合的目标是同时保留两者优势，得到高分辨率的多光谱影像。",
      "teaching_note": "常见融合方法：Brovey（比值变换）、IHS（色彩空间变换）、PCA（主成分替换）、Gram-Schmidt。",
      "completion_hint": "能说出全色与多光谱数据各自的优缺点。"
    },
    {
      "title": "Brovey Fusion",
      "title_zh": "Brovey 融合",
      "description_zh": "执行 rs:image_fusion 算子（method=brovey）：R_fused = R_ms × Pan / (R_ms + G_ms + B_ms)。本演示中全色与多光谱均使用样本影像。",
      "operator_id": "rs:image_fusion",
      "params": {
        "pan": "data/samples/landsat_sample.tif",
        "ms": "data/samples/landsat_sample.tif",
        "method": "brovey",
        "output": "outputs/lab07_brovey.tif"
      },
      "teaching_note": "Brovey 通过归一化光谱比值注入全色细节，计算简单但高保真度依赖波段光谱响应与全色波段接近。",
      "completion_hint": "融合影像空间细节提升。"
    },
    {
      "title": "IHS Fusion",
      "title_zh": "IHS 融合",
      "description_zh": "再次执行 rs:image_fusion 算子（method=ihs）：将 RGB 变换到 IHS 色彩空间，用全色影像替换亮度分量 I，再逆变换回 RGB。对比其与 Brovey 的光谱保真度。",
      "operator_id": "rs:image_fusion",
      "params": {
        "pan": "data/samples/landsat_sample.tif",
        "ms": "data/samples/landsat_sample.tif",
        "method": "ihs",
        "output": "outputs/lab07_ihs.tif"
      },
      "teaching_note": "IHS 融合把空间细节与光谱信息分离——亮度承载细节、色调饱和度承载光谱，因此光谱失真相对可控。",
      "completion_hint": "能够比较两种融合结果的光谱差异。"
    }
  ],
  "thinking_questions": [
    "为什么融合结果的色彩会偏离原始多光谱影像？哪种方法失真更小？",
    "融合前是否需要对全色与多光谱影像做配准？配准误差会带来什么伪影？",
    "PCA 融合用第几主成分替换全色影像？为什么？"
  ]
}
